{
  "project": {
    "name": "@wonseok-han/harness-core",
    "framework": "unknown",
    "packageManager": "npm",
    "language": "typescript"
  },
  "architecture": {
    "style": "modular",
    "enforceIndexGen": true,
    "forbiddenImports": {}
  },
  "development": {
    "linter": "eslint",
    "formatter": "prettier",
    "styling": ""
  },
  "testing": {
    "runner": "vitest",
    "minCoverage": {
      "statements": 80,
      "branches": 75,
      "functions": 80,
      "lines": 80
    },
    "requireTestFileWithImplementation": false
  },
  "agent": {
    "persona": "senior-developer",
    "allowedScopes": [
      "src/**/*",
      "tests/**/*"
    ],
    "adapters": ["claude"]
  }
}
